{
  "$schema": "https://json-schema.org/draft/2020-12/schema",
  "$id": "https://raw.githubusercontent.com/QaidVoid/errand/main/config.schema.json",
  "title": "errand configuration",
  "type": "object",
  "description": "The fully resolved configuration the daemon runs on.",
  "additionalProperties": false,
  "properties": {
    "chat": {
      "description": "Chat connection and who may drive the bot.",
      "type": "object",
      "additionalProperties": false,
      "properties": {
        "token": {
          "description": "Bot token. Secret. Never enters a sandbox.",
          "type": "string"
        },
        "channelId": {
          "description": "The single channel the daemon serves. Everything else is ignored.",
          "type": "string"
        },
        "allowedUserIds": {
          "description": "Accounts permitted to drive sessions. Must not be empty. The single entry `ALLOW_EVERY_USER` opens it to everyone who can post in the served channel. That is a deliberate, visible choice: an empty list is still a refusal to start, so nobody arrives at open access by leaving a field blank.",
          "type": "array",
          "items": {
            "type": "string"
          }
        },
        "blockedUserIds": {
          "description": "Accounts refused before anything else is considered. Ahead of the allowlist and of any session role, so excluding somebody is one decision rather than an audit of every list they appear on.",
          "type": "array",
          "items": {
            "type": "string"
          }
        },
        "operatorUserIds": {
          "description": "Accounts that may control any session, not only their own.",
          "type": "array",
          "items": {
            "type": "string"
          }
        },
        "startOnMention": {
          "description": "Require a message to mention the bot before it starts a session. Off by default, so every top-level message in the served channel starts one. Turn it on where the channel is also used for talking: people can then hold an ordinary conversation in it, and only a message addressed to the bot opens a thread and a sandbox.",
          "type": "boolean"
        }
      },
      "required": [
        "token",
        "channelId",
        "allowedUserIds",
        "blockedUserIds",
        "operatorUserIds"
      ]
    },
    "agent": {
      "description": "Which model the agent talks to, and the credential it reaches it with.",
      "type": "object",
      "additionalProperties": false,
      "properties": {
        "provider": {
          "description": "Provider id, such as `anthropic` or `zai-coding-cn`.",
          "type": "string"
        },
        "model": {
          "description": "Model pattern or id. Omit to use the provider's default.",
          "type": "string"
        },
        "visionModel": {
          "description": "Model an image is shown to when the working model cannot see one. Omit and the cheapest model of the same provider that accepts images is used. Naming one here is how that choice is made deliberately.",
          "type": "string"
        },
        "credentialName": {
          "description": "Environment variable the agent reads, such as `ANTHROPIC_API_KEY`.",
          "type": "string"
        },
        "credential": {
          "description": "The credential value. Secret.",
          "type": "string"
        },
        "delegate": {
          "description": "A cheaper model the session's model may ask about one artefact. Absent means no delegation at all: the session's own model does everything, which is what it did before this existed.",
          "type": "object",
          "additionalProperties": false,
          "properties": {
            "model": {
              "description": "The model asked. Must be one the provider serves under the same key.",
              "type": "string"
            },
            "perTurn": {
              "description": "How many delegations one turn may make before the rest stay at home.",
              "type": "number"
            },
            "deadlineMs": {
              "description": "How long one delegation may take before it is abandoned.",
              "type": "number"
            },
            "baseUrl": {
              "description": "Where the provider is reached, when the model store does not say. Read from the agent's own model store by default, so the same endpoint that serves the session is the one asked.",
              "type": "string"
            }
          },
          "required": [
            "model"
          ]
        }
      },
      "required": [
        "provider",
        "credentialName",
        "credential"
      ]
    },
    "github": {
      "description": "The GitHub identity a session works with, when one is configured. Optional: a session with no GitHub configuration still runs, and simply has no credential to reach a repository with.",
      "type": "object",
      "additionalProperties": false,
      "properties": {
        "token": {
          "description": "Token the agent authenticates with. Secret, and reachable by the agent.",
          "type": "string"
        },
        "userName": {
          "description": "Name commits are authored with. Free text: where a fork lands is read back from the API, so this does not have to be the bot's login.",
          "type": "string"
        },
        "userEmail": {
          "description": "Email commits are authored with.",
          "type": "string"
        }
      },
      "required": [
        "token",
        "userName",
        "userEmail"
      ]
    },
    "projectRoot": {
      "description": "Absolute path under which every session's project directory lives. A session works in a subdirectory of this and nowhere else.",
      "type": "string"
    },
    "stateDir": {
      "description": "Where per-session state directories are created on the host.",
      "type": "string"
    },
    "sandbox": {
      "description": "What a session may consume, and what the backend enforces.",
      "type": "object",
      "additionalProperties": false,
      "properties": {
        "backend": {
          "description": "Which backend confines sessions.",
          "type": "string",
          "enum": [
            "podman",
            "bailey"
          ]
        },
        "requireFullEnforcement": {
          "description": "Refuse to start when the backend cannot enforce every configured guarantee on this host, rather than reporting the gap and continuing.",
          "type": "boolean"
        },
        "network": {
          "description": "Network exposure granted to a session.",
          "type": "string",
          "enum": [
            "restricted",
            "none"
          ]
        },
        "egressPorts": {
          "description": "Ports a session may open outbound, when the network is not `none`. The default is HTTPS alone, which is all a model provider needs. Adding a port widens what a session can reach: 80 lets it speak plaintext HTTP, so a mirror or a redirect that has not moved to TLS resolves. Enforced by the generated policy, so it holds under the bailey backend; podman bounds the network by namespace rather than by port.",
          "type": "array",
          "items": {
            "type": "number"
          }
        },
        "image": {
          "description": "Container image the podman backend runs. Inert under bailey.",
          "type": "string"
        },
        "memory": {
          "description": "Memory ceiling per session, in size syntax such as `4g`.",
          "type": "string"
        },
        "cpus": {
          "description": "CPU ceiling per session, in cores.",
          "type": "number"
        },
        "pids": {
          "description": "Process count ceiling per session.",
          "type": "number"
        },
        "fileMax": {
          "description": "Largest single file a session may write, in size syntax.",
          "type": "string"
        },
        "disk": {
          "description": "How much a session may add to its project and state together. Measured rather than enforced, because no backend caps what a process tree writes in aggregate without root. Passing it ends the session.",
          "type": "string"
        },
        "diskCheckMs": {
          "description": "How often a session's disk use is measured, in milliseconds.",
          "type": "number"
        },
        "gracePeriodMs": {
          "description": "How long a sandbox may take to stop before it is killed.",
          "type": "number"
        },
        "hideHostAddress": {
          "description": "Hide the host's network identity from a session, when it has a network. A session shares the host's network namespace by default, so it can read the host address, the MAC, and the ARP neighbours. With this set, the bailey backend runs egress through a private namespace instead, so a session sees a synthetic address and MAC. The namespace gets IPv6 as well where the host has it, and the ports a session may open are unchanged. The podman backend already gives each session its own network, so this does not apply to it.",
          "type": "boolean"
        },
        "policyExtra": {
          "description": "Paths granted to a session on top of what the daemon already grants. Additive only. The generated policy still places the project and the state directory, still bounds the environment, and still clears the backend's own profile first; this names more that a session may reach, and can take nothing away. Every path is absolute, since a relative one in a policy means nothing. What is granted here is reported at startup, so the enforcement report never describes a tighter boundary than the one actually applied.",
          "type": "object",
          "additionalProperties": false,
          "properties": {
            "read": {
              "description": "Directories or files a session may read.",
              "type": "array",
              "items": {
                "type": "string"
              }
            },
            "write": {
              "description": "Directories or files a session may write. Widens what it can change.",
              "type": "array",
              "items": {
                "type": "string"
              }
            },
            "execute": {
              "description": "Directories a session may execute from.",
              "type": "array",
              "items": {
                "type": "string"
              }
            }
          },
          "required": [
            "read",
            "write",
            "execute"
          ]
        },
        "pathExtra": {
          "description": "Directories added to a session's PATH, or undefined for none. Named after the agent's own wrappers and ahead of the system directories, so a program named here is the one a session finds. This adds nothing a session may reach: a directory that is not also granted under `PolicyExtraConfig` is a name on a path leading nowhere. The podman backend takes its PATH from the image and ignores this.",
          "type": "array",
          "items": {
            "type": "string"
          }
        },
        "env": {
          "description": "Variables set in every session's environment, or undefined for none. The environment is built rather than inherited, so a toolchain that reads one has no other way to be told. `PATH` and `HOME` are refused, since the daemon sets both to paths the policy places, and so is the name carrying the provider credential. A name the daemon sets itself keeps the daemon's value. Every value reaches the agent, so nothing secret belongs here.",
          "type": "object",
          "additionalProperties": {
            "type": "string"
          }
        }
      }
    },
    "output": {
      "description": "How much of the agent's activity reaches the thread.",
      "type": "object",
      "additionalProperties": false,
      "properties": {
        "forwardToolOutput": {
          "description": "Whether tool output bodies are posted, not just that a tool ran.",
          "type": "boolean"
        },
        "maxToolOutputChars": {
          "description": "Longest tool output posted before it is truncated and marked as such.",
          "type": "number"
        },
        "maxAttachmentBytes": {
          "description": "Largest attached file taken into a session, in bytes. Well under what the chat service itself allows, on purpose: the limit is what is sensible to hand an agent, not what can be uploaded.",
          "type": "number"
        },
        "maxAttachmentsPerMessage": {
          "description": "Most attached files taken from one message. The rest are refused.",
          "type": "number"
        },
        "postDiffs": {
          "description": "Post a diff after the agent changes a file. A diff shows intent rather than contents, which is both smaller and less likely to put something private in a channel than uploading whole files.",
          "type": "boolean"
        }
      }
    },
    "shutdown": {
      "description": "Who may power off the host from a chat message. Off unless the list has somebody in it. This is the one command that acts on the machine rather than on a session, so it is not covered by any session role: whoever starts a thread owns it, and owning a thread is no reason to be able to turn the computer off.",
      "type": "object",
      "additionalProperties": false,
      "properties": {
        "allowedUserIds": {
          "description": "Account ids permitted to power off the host.",
          "type": "array",
          "items": {
            "type": "string"
          }
        }
      },
      "required": [
        "allowedUserIds"
      ]
    },
    "limits": {
      "description": "Bounds on how much work exists at once.",
      "type": "object",
      "additionalProperties": false,
      "properties": {
        "maxConcurrentTurns": {
          "description": "Sessions that may have a model turn in flight simultaneously.",
          "type": "number"
        },
        "maxLiveSessions": {
          "description": "Sessions that may exist at all.",
          "type": "number"
        },
        "maxQueueLength": {
          "description": "Prompts that may wait for a turn slot.",
          "type": "number"
        },
        "maxQueueWaitMs": {
          "description": "How long a queued prompt may wait before it expires unsent.",
          "type": "number"
        }
      }
    },
    "timeouts": {
      "description": "Deadlines that end or unblock a session.",
      "type": "object",
      "additionalProperties": false,
      "properties": {
        "idleMs": {
          "description": "No message and no agent activity for this long ends the session.",
          "type": "number"
        },
        "startupMs": {
          "description": "How long the agent has to become ready before it is abandoned.",
          "type": "number"
        },
        "questionMs": {
          "description": "How long a question posted to a thread waits for an answer.",
          "type": "number"
        },
        "abortMs": {
          "description": "How long an abort waits for the agent before it is forced.",
          "type": "number"
        }
      }
    },
    "$schema": {
      "type": "string",
      "description": "Where this schema lives."
    }
  },
  "required": [
    "chat",
    "agent",
    "projectRoot",
    "stateDir",
    "sandbox",
    "output",
    "shutdown",
    "limits",
    "timeouts"
  ]
}
